[
    {
        "_id": {
            "$oid": "69f31e98872951e92b419124"
        },
        "version": "001",
        "description": "Creează colecția coșuri de cumpărături cu un index unic care asigură existența unui singur coș per utilizator.",
        "checksum": "7fd043659a221bf05ce3a27a2bee05f0876628422c9a1bd4600304bf705239b0",
        "appliedAt": {
            "$date": "2026-04-30T09:19:20.967Z"
        }
    },
    {
        "_id": {
            "$oid": "69f31e99872951e92b419125"
        },
        "version": "002",
        "description": "Normalizează câmpurile priceAtAdd ale elementelor din coș pentru a fi compatibile cu Decimal128.",
        "checksum": "72eab018cd5e9ac0e3a580dc082929007fc91a42f06a0732a0aec1d57f28b989",
        "appliedAt": {
            "$date": "2026-04-30T09:19:21.303Z"
        }
    }
]