[
    {
        "_id": {
            "$oid": "69f31c1f0ae24be315cedb68"
        },
        "version": "001",
        "description": "Creează colecția profiluri de utilizatori cu indexuri canonice de identitate.  ",
        "checksum": "157532c6ac05bbff797b55a356637fb217dd72e074c70d5de99b4807ba7e90a9",
        "appliedAt": {
            "$date": "2026-04-30T09:08:47.641Z"
        }
    },
    {
        "_id": {
            "$oid": "69f31c1f0ae24be315cedb69"
        },
        "version": "002",
        "description": "Completează retroactiv câmpul activ pentru documentele existente din colecția profilurilor de utilizatori.",
        "checksum": "338844a37838f0aa55ad4f6114cb77487d46fb1564e8a41a48f8800d060b917d",
        "appliedAt": {
            "$date": "2026-04-30T09:08:47.961Z"
        }
    }
]